<?xml version="1.0" encoding="UTF-8"?>
<Quizzer xmlns:xsi="http://www.w3.org/2001/XMLSchema-instance"
    xsi:noNamespaceSchemaLocation="file:/F:/Dox/GitHub/quizzer_project/development/schema/quizzer_new.xsd">
    <course id="DRWO-101-01">
        <exam prof_UID="123456789" stud_UID="000000001" exam_id="01">
            <MCQ number="1">
                <ques>In the start of Season 8 of the new Doctor Who how many Doctors has there been? <!-- should we have a specific element for this? -->
                    <option id="a">5</option>
                    <option id="b">15</option>
                    <option id="c">13</option>
                    <option id="d">12</option>
                </ques>
                <ans>a</ans>
                <max-score>10</max-score>
                <prof-answer></prof-answer>
                <prof-score>0.0</prof-score>
             </MCQ>
            <Desc_question number="2">
                <ques>In what ways does a Time Lord differ from a human? </ques>
                <ans>
                    <para>I dont know</para>
                </ans>
                <max-score>10</max-score>
                <prof-answer></prof-answer>
                <prof-score>4.0</prof-score>
                
            </Desc_question>
            <MCQ number="3">
                <ques> What does TARDIS stand for?
                    <option id="a">Time and Relative Dimension in Space</option>
                    <option id="b">Tea and Really Delicious Italian Spaghetti </option>
                    <option id="c">Time and Running Down Initial Space </option>
                    <option id="d">Totally Awesome Random Devise in Space</option>
                </ques>
                <ans>c</ans>
                <max-score>10</max-score>
                <prof-answer></prof-answer>
                <prof-score></prof-score>
               
            </MCQ>
            <Desc_question number="4">
                <ques>Who is the Doctors greatest foe? </ques>
                <ans>
                    <para>cute robot</para>
                </ans>
                <max-score>10</max-score>
                <prof-answer></prof-answer>
                <prof-score>10.0</prof-score>
            </Desc_question>
            <MCQ number="5">
                <ques> What year was Doctor Who started in?
                    <option id="a">2005</option>
                    <option id="b">1963</option>
                    <option id="c">1996</option>
                    <option id="d">1989</option>
                </ques>
                <ans>b</ans>
                <max-score>10</max-score>
                <prof-answer></prof-answer>
                <prof-score></prof-score>
            </MCQ>
            <Match number="6">
                <ques> Match the foe to the picture.
                    <item number="1">Daleks</item>
                    <item number="2">Weeping Angles</item>
                    <item number="3">The Silence</item>
                    <item number="4">The Ood</item>
                    <item number="5">Cybermen</item>
                    <option id="a">../media/the_cybermen.jpg</option>
                    <option id="b">../media/the_daleks.jpg</option>
                    <option id="c">../media/the_ood.jpg</option>
                    <option id="d">../media/the_silence.jpg</option>
                    <option id="e">../media/weeping_angles.jpg</option>
                </ques>
                <ans>
                    <item number="1">b</item>
                    <item number="2">a</item>
                    <item number="3">c</item>
                    <item number="4">d</item>
                    <item number="5">e</item>
                </ans>
                <max-score>10</max-score>
                <prof-answer></prof-answer>
                <prof-score>10</prof-score>
            </Match>
            <Desc_question number="7">
                <ques>Who does the Doctor normally travel with?</ques>
                <ans>
                    <para>blond pretty girl</para>
                </ans>
                <max-score>10</max-score>
                <prof-answer></prof-answer>
                <prof-score>10</prof-score>
            </Desc_question>
            <MCQ number="8">
                <ques>In the start of Season 8 of the new Doctor Who how many Companions has the Doctor had?
                    <option id="a">8</option>
                    <option id="b">34</option>
                    <option id="c">46</option>
                    <option id="d">54</option>
                </ques>
                <ans>c</ans>
                <max-score>10</max-score>
                <prof-answer></prof-answer>
                <prof-score></prof-score>
            </MCQ>
            <Desc_question number="9">
                <ques>Who does Captain Jack Harkness become and how?</ques>
                <ans>
                    <para> I dont know</para>
                </ans>
                <max-score>10</max-score>
                <prof-answer></prof-answer>
                <prof-score></prof-score>
            </Desc_question>
            <MCQ number="10">
                <ques>
                    <option id="a">Intellect </option>
                    <option id="b">Sonic Screw Driver</option>
                    <option id="c">Wit</option>
                    <option id="d">Compassion</option>
                    <option id="e"> All of the above</option>
                </ques>
                <ans>e</ans>
                <max-score>10</max-score>
                <prof-answer></prof-answer>
                <prof-score></prof-score>
            </MCQ>
        </exam>
    </course>
</Quizzer>