<?xml version="1.0" encoding="UTF-8"?>
<Quizzer xmlns:xsi="http://www.w3.org/2001/XMLSchema-instance"
    xsi:noNamespaceSchemaLocation="file:/F:/Dox/GitHub/quizzer_project/development/schema/quizzer_new.xsd">
    <course id="ISTE-601-13">
        <exam prof_UID="012345678" stud_UID="123456789" exam_id="">
            <instr>blah blah blah
            <hyperlink>links</hyperlink>
            <img name="blahImage" path="D:/blah.jpg" />
            <list>
                <item number="1">hello</item>
                <item number="2">world</item>
            </list>
                I am an idiot
            </instr>
            
            <MCQ number="1">
                <ques>
                    <option id="a">optionA</option>
                    <option id="b">optionB</option>
                    <option id="c">optionC</option>
                </ques>
                <ans>a</ans>
                <prof-answer>B because F you thats y</prof-answer>
                <prof-score>0</prof-score>
            </MCQ>
            <Desc_question number="2">
                <ques>blah blah
                <list>
                    <item number="1">I am a blah</item>
                    <item number="2">I am a bla blah</item>
                </list></ques>
                <ans>
                    <para>GERONIMO</para>
                    <para>ALLONSy</para>
                </ans>
            </Desc_question>
            
            
        </exam>
    </course>
</Quizzer>